{
  "profile_id": "canonical.instructor_guide.v0_1",
  "output_type": "instructor_guide",
  "allowed_rails": ["aya", "canonical", "prism"],
  "allowed_visibility_scopes": ["aya_classroom", "canonical_internal", "prism_private"],
  "required_source_fields": ["program_key", "module_key", "session_key", "source_path"],
  "output_contract": {
    "format": "markdown+json",
    "required_sections": ["context", "teaching_moves", "risks", "evidence_checks", "next_day_bridge"]
  },
  "forbidden_patterns": ["access_token", "Bearer ", "C:/Users/"],
  "status": "approved",
  "notes": "Must be filtered by visibility scope before downstream export."
}
